{
  "calendar_version": "1.0.0",
  "generated_at": "2026-10-22T15:06:41.703Z",
  "source_archive": "hf_ebird_records_final.csv",
  "public_species_source": "birds_hf_public.csv",
  "public_species_count": 133,
  "calendar_species_count": 133,
  "reconciliation_passed": true,
  "missing_from_calendar": 0,
  "unexpected_in_calendar": 0,
  "species_with_arrivals": 30,
  "species_with_departures": 30,
  "resident_species": 55,
  "scarce_irregular_species": 48,
  "high_confidence_species": 60,
  "medium_confidence_species": 12,
  "low_confidence_species": 61,
  "duplicate_species_found": false,
  "invalid_months_found": false,
  "invalid_movement_types_found": false,
  "invalid_confidence_values_found": false,
  "changes_detected": 60,
  "arrival_changes": 30,
  "departure_changes": 30,
  "movement_type_changes": 0,
  "confidence_changes": 0,
  "methodology_version": "1.0",
  "calculation_basis": "public-layer-filtered archive analysis",
  "validation_passed": true,
  "expected_board_status": "READY"
}
